{
  "$schema": "http://json-schema.org/draft-07/schema#",
  "$id": "https://github.com/antiserum-ai/oaep/raw/main/docs/schema/oaep-receipt.schema.json",
  "title": "OAEP execution receipt",
  "description": "Draft oaep/0.1 receipt (PRD §9). Level-0 is a signed agent claim. Hash, hex, JCS, Ed25519, and Merkle encodings are defined in docs/canonical.md. This schema still accepts any 0x-prefixed hex so older fixtures remain structurally valid. Produced values use SHA-256 (32 bytes) and Ed25519 signatures (64 bytes). This schema does not implement TEE/zk verification, a blockchain, or a hosted verifier.",
  "type": "object",
  "additionalProperties": true,
  "required": [
    "version",
    "execution_id",
    "agent",
    "task",
    "output",
    "signature"
  ],
  "properties": {
    "version": {
      "const": "oaep/0.1",
      "description": "Protocol version tag. Must be the string oaep/0.1 for this schema."
    },
    "execution_id": {
      "$ref": "#/$defs/hexBytes",
      "description": "Unique id for this execution. Produced values are SHA-256 commitments (docs/canonical.md)."
    },
    "agent": {
      "$ref": "#/$defs/agent",
      "description": "Executing agent identity (PRD §11). Receipts are signed by this agent."
    },
    "task": {
      "$ref": "#/$defs/task",
      "description": "Commitment to the task / user intent. Raw prompt is not required (PRD §25)."
    },
    "models": {
      "type": "array",
      "description": "Models that participated. Empty if none. Item fields beyond identity are unstable (PRD §12).",
      "items": {
        "$ref": "#/$defs/model"
      }
    },
    "tools": {
      "type": "array",
      "description": "Tool invocations with input/output commitments (PRD §13). Raw I/O need not be public.",
      "items": {
        "$ref": "#/$defs/tool"
      }
    },
    "delegations": {
      "type": "array",
      "description": "Child-agent receipts referenced by this parent (PRD §14). delegations[].receipt is SHA-256(JCS(child)) (docs/canonical.md). Children are local files only.",
      "items": {
        "$ref": "#/$defs/delegation"
      }
    },
    "output": {
      "$ref": "#/$defs/output",
      "description": "Commitment to the execution result."
    },
    "execution": {
      "$ref": "#/$defs/executionMeta",
      "description": "When and where the agent ran. Environment string is unstable."
    },
    "proofs": {
      "type": "array",
      "description": "Optional attestations / proofs (PRD §15 levels 2–4). Shape is unstable; Level-0 does not require this array.",
      "items": {
        "$ref": "#/$defs/proof"
      }
    },
    "trace_root": {
      "$ref": "#/$defs/hexBytes",
      "description": "Merkle root of the execution-event trace (PRD §10). Leaf/node encoding is in docs/canonical.md. Optional for Level-0 schema-only verify."
    },
    "signature": {
      "$ref": "#/$defs/hexBytes",
      "description": "Ed25519 signature over JCS(receipt without signature). Produced values are 64 bytes (0x + 128 hex). See docs/canonical.md. The schema only requires a non-empty 0x-prefixed hex string."
    }
  },
  "$defs": {
    "hexBytes": {
      "type": "string",
      "pattern": "^0x[0-9a-fA-F]+$",
      "minLength": 3,
      "description": "0x-prefixed hex. Produced SHA-256 values are 32 bytes; Ed25519 signatures are 64 bytes. See docs/canonical.md. Length is not constrained here so older fixtures remain structurally valid."
    },
    "unixSeconds": {
      "type": "integer",
      "minimum": 0,
      "description": "Unix timestamp in seconds (UTC)."
    },
    "agent": {
      "type": "object",
      "additionalProperties": true,
      "required": ["id"],
      "properties": {
        "id": {
          "type": "string",
          "minLength": 1,
          "description": "Cryptographic agent identity. This package uses did:agent:ed25519:<hex> (PRD §11). Other DID methods may appear."
        },
        "public_key": {
          "$ref": "#/$defs/hexBytes",
          "description": "Ed25519 public key, 0x-prefixed hex (32 bytes when produced). Optional if agent.id is did:agent:ed25519:<hex>. See docs/canonical.md."
        },
        "version": {
          "type": "string",
          "minLength": 1,
          "description": "Agent software / policy version string. Unstable."
        }
      }
    },
    "task": {
      "type": "object",
      "additionalProperties": true,
      "required": ["commitment"],
      "properties": {
        "commitment": {
          "$ref": "#/$defs/hexBytes",
          "description": "Commitment to task input: SHA-256(preimage || nonce). Preimage is not part of the receipt (docs/canonical.md)."
        }
      }
    },
    "model": {
      "type": "object",
      "additionalProperties": true,
      "required": ["identity"],
      "properties": {
        "identity": {
          "$ref": "#/$defs/hexBytes",
          "description": "Model identity commitment (SHA-256 digest when produced). See docs/canonical.md."
        },
        "fingerprint": {
          "$ref": "#/$defs/hexBytes",
          "description": "Optional model fingerprint (e.g. Sentient Model Fingerprinting). Unstable."
        },
        "version": {
          "type": "string",
          "minLength": 1,
          "description": "Model version or revision label. Unstable."
        }
      }
    },
    "tool": {
      "type": "object",
      "additionalProperties": true,
      "required": ["identity"],
      "properties": {
        "identity": {
          "$ref": "#/$defs/hexBytes",
          "description": "Tool identity commitment."
        },
        "input_commitment": {
          "$ref": "#/$defs/hexBytes",
          "description": "Commitment to tool input: SHA-256(preimage || nonce)."
        },
        "output_commitment": {
          "$ref": "#/$defs/hexBytes",
          "description": "Commitment to tool output: SHA-256(preimage || nonce)."
        }
      }
    },
    "delegation": {
      "type": "object",
      "additionalProperties": true,
      "required": ["agent", "receipt"],
      "properties": {
        "agent": {
          "type": "string",
          "minLength": 1,
          "description": "Child agent id (preferred did:agent:…)."
        },
        "receipt": {
          "$ref": "#/$defs/hexBytes",
          "description": "SHA-256(JCS(child receipt including signature)). This is the hash of the child's canonical bytes, not the child's execution_id. Inline nested receipt objects are not supported. See docs/canonical.md."
        },
        "path": {
          "type": "string",
          "minLength": 1,
          "description": "Optional local filesystem path to the child receipt JSON (absolute, or relative to the parent receipt). Never fetched over the network."
        }
      }
    },
    "output": {
      "type": "object",
      "additionalProperties": true,
      "required": ["commitment"],
      "properties": {
        "commitment": {
          "$ref": "#/$defs/hexBytes",
          "description": "Commitment to the produced output: SHA-256(preimage || nonce)."
        }
      }
    },
    "executionMeta": {
      "type": "object",
      "additionalProperties": true,
      "properties": {
        "environment": {
          "type": "string",
          "description": "Free-form execution environment label (runtime, TEE class, host). Unstable; not an attestation."
        },
        "started_at": {
          "$ref": "#/$defs/unixSeconds"
        },
        "completed_at": {
          "$ref": "#/$defs/unixSeconds"
        }
      }
    },
    "proof": {
      "type": "object",
      "additionalProperties": true,
      "required": ["type"],
      "properties": {
        "type": {
          "type": "string",
          "minLength": 1,
          "description": "Proof / attestation class. Examples from the PRD: tee, remote_attestation, zkml, zkvm, signature, reproducible. Closed enum is deferred; this field is unstable."
        },
        "proof": {
          "description": "Opaque proof or attestation material. Encoding is unstable (string today; structured objects later).",
          "oneOf": [
            {
              "type": "string",
              "minLength": 1
            },
            {
              "type": "object"
            }
          ]
        }
      }
    }
  }
}
